{
  "schema": "motion-reference-analysis",
  "schema_version": "0.2.0",
  "reference_id": "PRO_MOTION_2D_A",
  "evidence_level": "METADATA_ONLY",
  "observations": [
    {
      "status": "OBSERVED",
      "statement": "The public source identifies the work as a motion design and animation showreel by Will Taylor.",
      "provenance": "YouTube title/creator metadata for RB0X7CojhZ8"
    },
    {
      "status": "OBSERVED",
      "statement": "A secondary public listing reports an approximate duration of 27 seconds.",
      "provenance": "Raivcoo metadata listing for the same title and creator"
    }
  ],
  "sequences": [],
  "technique_atoms": [],
  "technique_compositions": [],
  "motion_signature": {
    "continuity": "UNKNOWN",
    "transformation_density": "UNKNOWN",
    "camera_usage": "UNKNOWN",
    "depth_usage": "UNKNOWN",
    "typography_integration": "UNKNOWN",
    "asset_richness": "UNKNOWN",
    "causal_chaining": "UNKNOWN"
  },
  "inferred_capabilities": [],
  "uncertainties": [
    "No local timecoded media was supplied; no sequence, technique, tool, or asset claim is made from title metadata alone."
  ]
}
